While in Baku, had an opportunity to attend the #F1 #AzerbaijanGP 2022. Sports like F1 have the ability to bring people together.
Formula 1® has electrified fans across the globe with the sights and sounds of the world’s best drivers
It would seem unfair to penalise the ones that have done a decent job versus the ones that have perhaps missed the target.
Some of the spectacular photos from Baku. 🤩🤩
The #DHLFastestPitStop Charts from Baku come with a surprise: @alo_oficial and @AlpineF1Team top them for the first time.
A tough break for Leclerc as his Baku hopes go up in smoke 😖
